{
    "generalSetting": {
        "seed": 42
    },
    "inputPathParams": {
        "database_path": "data/processed/tube_geometry.db",
        "machine_part": "De-Clamping",
        "annotation_json_path": "data/ml/machine-and-movement_complete.json"
    },
    "preprocessingParams": {
        "to_58_excluded": true,
        "seperate_test_set": true,
        "random_seed": 42,
        "agg_metric": "mean",
        "window_num": 100,
        "feature_indices": [
            1,
            5
        ],
        "annot_timesteps": [
            150,
            340,    
            820,
            1280
        ],
        "mandrel_extraction_annot_timesteps":[
            650, 
            820
        ]
    },
    "trainingParams": {
        "train": false,
        "hidden_dim": 32,
        "lstm_layers": 1,
        "dropout": 0.2,
        "lr": 0.0005,
        "weight_decay": 5e-4,
        "batch_size": 8,
        "max_epochs": 1,
        "model_path": "models/context_extraction"
    },
    "occlusionParams":{
        "occlusion_window_size": 50,
        "occlusion_stride": 50
    }
}